"amazon_review.content","amazon_review.sentiment","accessori","amazon","bad","buy","come","custom","day","deliv","drain","dri","featur","filter","get","give","good","instal","lint","look","machin","mention","miss","money","new","one","pipe","pleas","product","purchas","qualiti","receiv","replac","return","servic","technician","time","use","wash","water","work"
"Their customer care sucks big time. I purchased it from a local dealer and had a question whether the model has a drain pump or not. As a cost cutting measure they have ONE manual for all the 10000 models they have and it is not clear whether a particular model has a feature or not (very dangerous if the installation depends on the model - whether the model has drain pump built in or not).. Called their customer care - that lady wants to send a technician to my home and charge me, all I need is a small information and she put the phone down saying ""we don't provide information"" - in a rude tone. Clueless and customer unfriendly","negtive",0,0,0,0,0,0.219804400548766,0,0,0.156101154517376,0,0.0780505772586881,0,0,0,0,0.0573686950086893,0,0,0,0,0,0,0,0.0657219971657311,0,0,0,0.0550863153344373,0,0,0,0,0,0.0692246349465019,0.0732681335162555,0,0,0,0
"included components r missing...hose pipe etc ...only manual ia included..why is it not included in this ?dissapointing and .. n","negtive",0,0,0,0,0,0,0,0,0,0,0,0,0,0,0,0,0,0,0,0,0,0,0,0,0.423039435784178,0,0,0,0,0,0,0,0,0,0,0,0,0,0
"Worst product ,purchased it but got e3 error and raised it for replacement got new product without any surprise same error and its junk product","negtive",0,0,0,0,0,0,0,0,0,0,0,0,0,0,0,0,0,0,0,0,0,0,0.286185449948523,0,0,0,0.314063144951351,0.20198315622627,0,0,0.240980656274347,0,0,0,0,0,0,0,0
"The machine warranty period and motor warranty period is nowhere mentioned on the amazon website so how can we decide to buy","negtive",0,0.253290903786757,0,0.292873455542893,0,0,0,0,0,0,0,0,0,0,0,0,0,0,0.131370711423592,0.292873455542893,0,0,0,0,0,0,0,0,0,0,0,0,0,0,0,0,0,0,0
"Useless - E3 error since the day I purchased it, technicians are scarce to get!!!!. Amazon can’t help.. This piece is a waste of money.","negtive",0,0.235198696373418,0,0,0,0,0.246056060190921,0,0,0,0,0,0.306627267801989,0,0,0,0,0,0,0,0,0.306627267801989,0,0,0,0,0,0.216410524528147,0,0,0,0,0,0.271953923004115,0,0,0,0,0
"quality is OK..it's made in china products.in same range you will find made in india products.i suggest go for other products in same range.","negtive",0,0,0,0,0,0,0,0,0,0,0,0,0,0,0,0,0,0,0,0,0,0,0,0,0,0,0.392578931189189,0,0.317279576838134,0,0,0,0,0,0,0,0,0,0
"Not worth to buy this washing machine. It not wash and rinse normal dirty cloths. Stains remain as it was before washing. Wastage of money","negtive",0,0,0,0.271953923004115,0,0,0,0,0,0,0,0,0,0,0,0,0,0,0.121987089179049,0,0,0.306627267801989,0,0,0,0,0,0,0,0,0,0,0,0,0,0,0.507167642286776,0,0
"The main problem of this machine is can't select the appropriate wash programme & water level automatically according to weight of garments. The service technician told me that the sensor of this machine is not so good to sence weight of garments.. Now I'm selecting wash programme & water level manually.. This not desired from a automatic washing machine. Previously I had an LG washing machine and it could automatically select the appropriate wash program and water level.","negtive",0,0,0,0,0,0,0,0,0,0,0,0,0,0,0.0568554614575092,0,0,0,0.158866906837832,0,0,0,0,0,0,0,0,0,0,0,0,0,0.0840630196305862,0.0885431377222699,0,0,0.275207247752514,0.281145163492608,0
